{
  "$schema": "./schemas/asset-manifest-1.0.schema.json",
  "version": "1.0",
  "namespace": "dungeon",
  "texture": "tilesets/dungeon_tiles.png",
  "defaults": {
    "sprite": {
      "pivot": {
        "x": 0.5,
        "y": 1.0
      }
    },
    "tileset": {
      "pivot": {
        "x": 0.5,
        "y": 0.5
      }
    }
  },
  "tilesets": {
    "dungeon": {
      "description": "The complete 23-column by 24-row Buch dungeon sheet.",
      "grid": {
        "origin": {
          "x": 0,
          "y": 0
        },
        "frame": {
          "width": 16,
          "height": 16
        },
        "spacing": {
          "x": 0,
          "y": 0
        },
        "rows": 24,
        "columns": 23,
        "cell_order": "row-major"
      }
    }
  }
}
